{
  "type": "semantic_label",
  "seq": 17,
  "ts": 1785196801250000000,
  "body": {
    "map_id": "lab_bench_a",
    "labels": [
      {
        "label_id": "b6b4a3e2-6c2f-4f3f-9a1a-1d2e3f4a5b6c",
        "class_id": "cup",
        "confidence": 0.87,
        "source": "headset",
        "sensor": "passthrough_left",
        "frame_id": "map",
        "pose": {
          "t": [0.412, 0.905, -0.233],
          "q": [0.0, 0.0, 0.0, 1.0]
        },
        "extent": [0.08, 0.11, 0.08],
        "observed_at_ns": 1785196801180000000
      },
      {
        "label_id": "c7c5b4f3-7d3f-4a4a-8b2b-2e3f4a5b6c7d",
        "class_id": "bottle",
        "confidence": 1.0,
        "source": "human",
        "frame_id": "map",
        "pose": {
          "t": [0.615, 0.902, -0.101],
          "q": [0.0, 0.3826834, 0.0, 0.9238795]
        },
        "observed_at_ns": 1785196801210000000
      }
    ]
  }
}
